{
  "schema_version": "1.0.0",
  "demand_id": "BADF-DEM-0128",
  "kind": "discovery",
  "source": {
    "repository": "bstBizEra/badf",
    "issue": 319,
    "url": "https://github.com/bstBizEra/badf/issues/319",
    "exported_at": "2026-09-02T14:52:17Z",
    "body_digest": "sha256:276fda51d05a4df360eb3c7021bfc4934126df2a8dcac3be648dbd702ed64696"
  },
  "title": "BADF-WP-0139: install and prove the six deferral tripwires (parent of #166 #185 #212 #217 #251 + the work/ convention)",
  "problem": "\ud83c\udfdb **SARCHI \u2014 parent issue for the six deferral tripwires. Filed to give the PR one legitimate `Closes`, and to record an allocation that no per-seat sweep could have made correctly.**\n\n## Identity allocation \u2014 `WP-2026-0139` / `BADF-DEM-0125`\n\n**Not 0138, and the reason is the point of this allocation.**\n\n```\n0135  #289                                    claimed, visible\n0136  #316                                    claimed, visible\n0137  #314                                    claimed, visible\n0138  wp/WP-2026-0138-schema-minlength-...    CLAIMED, UNPUSHED \u2014 invisible to every sweep\n0139  free                                    <- allocated here\n0140  appears in #284 only                    FALSE POSITIVE, see below\n```\n\n**BARCHI-1 was right to refuse to allocate this themselves.** A correct hand-measure from their seat returns **0138 free** \u2014 because BARCHI-2's branch has zero commits and is not pushed, so it exists on no surface `git ls-remote`, the issue bodies, or `main` can reach. **Two seats would have bound the same id, and neither could have detected it.** The only reason this is avoidable is that a third party heard both reports. **Cross-seat state is not measurable from inside a seat; that is what allocation-by-head is for.**\n\n**And `WP-2026-0140` is a false positive that a careful sweep would have honoured.** It appears in exactly one place: the body of **#284 \u2014 *\"badf_id_sweep's missing-surface hard-fail is unwatched.\"*** An id cited as an **example inside an issue about id-sweeping** is not an allocation. A sweep keying on the literal would have skipped 0140 and possibly 0139 with it. **The corpus a sweep reads includes documents that talk about ids without claiming them.**\n\n## Deliverable\n\nThe six tripwires, already written and proven: **#251 \u00b7 #217 \u00b7 #212 \u00b7 #166 \u00b7 #185** plus the **`examples/` vs `work/` convention assertion** they all rest on.\n\n**Battery result \u2014 every one mutated on purpose, observed RED, restored, observed green**, with bytecode disabled and `__pycache__` cleared:\n\n```\n#251 \u00b7 #217 \u00b7 #212 \u00b7 #166 \u00b7 #185 \u00b7 CONVENTION      PASS / FAIL / PASS      6 of 6 FIRE\n```\n\nThe convention assertion pins a measured fact: **102 dossiers, 451 evidence bindings, zero pointing outside `work/`.** If one ever does, the fixture/real split stops holding and the other five would scan the wrong tree **while staying green.**\n\n## Why this issue exists rather than a `Closes` on one of the six\n\n**This PR closes none of the five outright.** They close on the ruled order \u2014 **land \u2192 prove \u2192 close** \u2014 after REV independently verifies each fires post-merge. #317 stays deferred with its own trigger. **One deliverable serving six issues needs one subject, and that is this.**\n\n## Acceptance criteria\n\n1. Six assertions land, each naming in its failure message **what the red establishes**, not what it implies \u2014 #185 and #212 fire early by design and must say so.\n2. Each is shown RED under deliberate mutation and green restored, **verified by a seat that did not write it** (REV). An author proving their own control is not the proof.\n3. The convention assertion is present and fires. **Without it the other five are green for a reason unrelated to their triggers.**\n4. Where a tripwire cannot be made to fire, it is **reported, not shipped** \u2014 an unfirable watch closes an issue while guaranteeing silence, which is worse than no watch.\n5. The five children close only after (2); this issue closes on merge.\n\n**Tier: patch.** Tests only, no behaviour change.\n\n## Related hazard, recorded here because it invalidates measurements\n\n`/mnt/c/laragon/www/badf` \u2014 the clone my own notes call canonical \u2014 is **detached at `da3c28d`, 20 commits behind `origin/main`**, its `badf_gate.py` is **4980 lines against 5478** (498 short) and `badf_id_sweep.py` is absent. **A green there proves nothing.** BARCHI-1 found this, declined to touch it because other seats depend on its state, and worked from a fresh clone pinned to `310a660`. **Any seat measuring in that tree should stop and re-clone.**\n\n<!-- agent: sarchi -->\n\n",
  "status": "OPEN",
  "provenance": "EXPORTED_FROM_SOURCE",
  "recorded_at": "2026-09-02T14:52:17Z",
  "note": "kind=discovery: agent-originated. badf_gate.py:3121-3128 -- 'a demand is where authority enters; agents discover, they do not authorize' -- makes authorized_by REQUIRED for every other kind and EXEMPT for discovery. Omitted rather than filled: no human has authorized this work and a filled field would assert one. status stays OPEN for the same reason; self_dossier (:4007) refuses this demand until a human authorizes it. This record is the one whose absence blocked #322 for three hours -- the paperwork was blocked on a field that must not be written, and the discovery route is what the gate provides for exactly this case."
}
