{
  "schema_version": "1.0.0",
  "demand_id": "BADF-DEM-0139",
  "kind": "issue",
  "source": {
    "repository": "bstBizEra/badf",
    "issue": 351,
    "url": "https://github.com/bstBizEra/badf/issues/351",
    "exported_at": "2026-10-03T00:00:00Z",
    "body_digest": "sha256:3bfab70b739ea23ecec386ac132f41c46c1944552aaf770cd9c99b3dc249d40f"
  },
  "title": "AET: learn from biztrust, biztrust_ib, bERP and badf-flow-control -- cross-repo learnings and an AET-B substrate design (no build)",
  "problem": "Operator request (2026-10-03, Claude Code session): build the Engineer Agentic Team by learning from `biztrust`, `biztrust_ib`, `bERP` and `badf-flow-control`. The operator chose the first deliverable: **a learnings record plus an AET-B design proposal**, not the runtime.\n\n## Why not build the runtime directly\n\n`docs/14-agentic-engineer-team.md` \u00a78 defines AET-B (runtime substrate) and gates it on P1-before-P3 prerequisites. Building the substrate without a recorded decision on that gate would bypass the doctrine. This issue therefore asks for the design and an honest gate reading. It does not ask for the build.\n\n## Scope\n\n1. Study the four repositories read-only. Re-measure each load-bearing claim against the files before writing it down; the readers' reports are model output.\n2. Write `docs/governance/AET_B_SUBSTRATE_DESIGN.md` covering:\n   - where the four teams converge;\n   - the failure modes they measured in themselves;\n   - what is deliberately not adopted;\n   - proposed substrate components, each mapped to docs/14's invariants and to its source;\n   - a sequencing proposal;\n   - the AET-B gate as measured;\n   - non-coverage.\n3. Add one learning under `docs/learnings/`.\n\n**Out of scope:**\n- building any component;\n- changing docs/14, `badf/seats.json`, `badf/authority-matrix.json`, any schema or `badf_gate.py`;\n- deciding whether #220 is dispositioned;\n- opening AET-B.\n\n## Acceptance criteria\n\n1. Every claim in the design is either listed as re-measured (file and line) or labelled *reported*.\n2. Each proposed component names the docs/14 invariants it serves and the source it is learned from.\n3. The AET-B gate is reported per prerequisite, with its measured state. An unmet or undecided prerequisite is reported as `HUMAN_REQUIRED`, never as met.\n4. The design states that it grants no authority and opens no rung (AET-I03).\n5. `badf_gate.py repo` passes; the suite stays green.\n\n\n---\n_Generated by [Claude Code](https://claude.ai/code)_",
  "authorized_by": {
    "principal": "operator",
    "principal_type": "human"
  },
  "recorded_at": "2026-10-03T00:00:00Z",
  "provenance": "EXPORTED_FROM_SOURCE",
  "status": "AUTHORIZED",
  "note": "ATTRIBUTED, not independently verifiable. The operator asked, in a Claude Code session on 2026-10-03, to build the Engineer Agentic Team by learning from biztrust, biztrust_ib, bERP and badf-flow-control. Asked to choose a first deliverable, they selected 'learnings + AET-B design' over building the runtime. Merge authority for this WP was NOT given in that exchange (an earlier merge-when-green approval covered WP-2026-0153 only). That selection is the authorisation recorded here; it authorises a design, not AET-B. No structural actor field distinguishes the operator from an agent under the shared bstBizEra account (#261 / #308)."
}
