{
  "schema_version": "1.0.0",
  "demand_id": "BADF-DEM-0141",
  "kind": "issue",
  "source": {
    "repository": "bstBizEra/badf",
    "issue": 355,
    "url": "https://github.com/bstBizEra/badf/issues/355",
    "exported_at": "2026-10-03T00:00:00Z",
    "body_digest": "sha256:7a98a7ea3c2615c8aef820ecf759433bb3e9131f7f83894b409188e951fac047"
  },
  "title": "Skills: vendor the BADF-compatible subset of Agent-Skills-for-Context-Engineering at IMPLEMENTED (pinned, overlaid, not routed)",
  "problem": "Operator request (2026-10-03, Claude Code session): \"install & adopt https://github.com/muratcankoylan/Agent-Skills-for-Context-Engineering into BADF\".\n\nThe repository (MIT, pinned at `58b55a8`) is a collection of 18 agent skills on context engineering. `badf/skill-registry.json` routes only approved skills (`default_policy: approved-only`), and docs/07 requires owner and security approval before a skill reaches `ACTIVE`. Adoption is therefore staged. The operator chose:\n- **vendor at `IMPLEMENTED`**, not routed;\n- **the compatible subset**: skills a read-only review rates `ADOPT-AS-IS` or `ADOPT-WITH-NOTES`.\n\n## Scope\n\n1. A read-only review of all 18 skills: trigger posture, conflicts with BADF invariants (cited `path:line`), script behaviour, and repo-level auto-loading surfaces.\n2. Vendor the compatible subset into `skills/<name>/`, **byte-identical** to upstream. Each skill gets a `BADF-PROVENANCE.json` (upstream commit and a per-file sha256) and `UPSTREAM-LICENSE` (MIT notice).\n3. Each `ADOPT-WITH-NOTES` skill gets a `BADF-OVERLAY.md` that takes precedence over the upstream text where they conflict.\n4. Register each skill at `IMPLEMENTED` with a sha256 digest, and add a test module that pins:\n   - the status;\n   - the byte-identity;\n   - overlay presence;\n   - exclusions;\n   - non-executable scripts.\n\n**Out of scope:**\n- routing or promoting any skill beyond `IMPLEMENTED`; each later step is its own WP with approval;\n- executing bundled scripts;\n- the excluded skills;\n- the repository's root `SKILL.md`, `AGENTS.md`, `CLAUDE.md`, plugin manifests, `governance/` and `researcher/`.\n\n## Acceptance criteria\n\n1. Every vendored file matches its pinned upstream digest, enforced by a test that is shown to fail when a byte changes.\n2. All vendored skills are `IMPLEMENTED`, each with an EXACT status pin, and the #218 coverage guard is green.\n3. Every `ADOPT-WITH-NOTES` skill has an overlay that cites the conflicting upstream line and the BADF rule.\n4. The excluded skills are absent from disk and from the registry, with the reasons recorded.\n5. `badf_gate.py repo` passes, and the composed suite is green.\n\n\n---\n_Generated by [Claude Code](https://claude.ai/code)_",
  "authorized_by": {
    "principal": "operator",
    "principal_type": "human"
  },
  "recorded_at": "2026-10-03T00:00:00Z",
  "provenance": "EXPORTED_FROM_SOURCE",
  "status": "AUTHORIZED",
  "note": "ATTRIBUTED, not independently verifiable. In a Claude Code session on 2026-10-03 the operator asked to 'install & adopt' Agent-Skills-for-Context-Engineering into BADF. Offered staged options, they chose 'vendor at IMPLEMENTED' and the 'compatible subset'. That selection authorises vendoring at IMPLEMENTED, not routing or promotion. Merge authority for this WP was not given in that exchange. No structural actor field distinguishes the operator from an agent under the shared bstBizEra account (#261 / #308)."
}
