{
  "schema_version": "1.0.0",
  "demand_id": "BADF-DEM-0143",
  "kind": "issue",
  "source": {
    "repository": "bstBizEra/badf",
    "issue": 359,
    "url": "https://github.com/bstBizEra/badf/issues/359",
    "exported_at": "2026-10-04T00:00:00Z",
    "body_digest": "sha256:a7a4244f551bc2a046959c94fc7c045ef3bcf82a08a693c6b36b8fb2c5dba6ba"
  },
  "title": "AET-B S3: the review package and verdict record -- a review bound to the exact candidate, by a run that is not the author's, with complete re-review and staleness",
  "problem": "Operator instruction (2026-10-04, Claude Code session): **\"start WP-2026-0158 and carry the reconcile\"**. This followed the recommendation, made when WP-2026-0157 landed, to build S3 next as WP-2026-0158. No merge-when-green authority has been given for this work package.\n\n## What this asks for\n\nBuild **S3** of the AET-B design (`docs/governance/AET_B_SUBSTRATE_DESIGN.md` \u00a75): the **review package and verdict record**. \u00a76 sequences it second, after S1, because independent review is the control the four source repositories most felt the absence of, and S2's dispatch envelope cites S3's verdict record.\n\n1. **Review package.** A read-only `badf_gate.py review-package <WP>` builds the candidate from `base..head`. It records the base and head SHAs, the content tree, the changed files and a diff digest, plus one package digest over all of them. It **refuses** a range that is not one:\n   - a base that is not an ancestor of head;\n   - an empty range, including one that changes nothing outside `work/<WP>/` and the lockfile;\n   - an unknown revision.\n2. **Verdict record.** A review is recorded at `work/<WP>/reviews/REV-NN.json` against `schemas/review-verdict.schema.json`. `badf_gate.py repo` validates every verdict:\n   - **bound:** the package digest recomputes from the verdict's own candidate fields;\n   - **independent:** the authoring and reviewing run ids differ, with no deviation path;\n   - **honest:** a verdict with no findings must state non-coverage, and APPROVE cannot stand beside an OPEN blocking finding;\n   - **complete re-review:** every finding the prior review left OPEN is dispositioned ADDRESSED or NOT_ADDRESSED, exactly once. A blocking finding left NOT_ADDRESSED refuses APPROVE.\n3. **Staleness.** A read-only `badf_gate.py review-check <WP>` rebuilds the package from the latest verdict's base to the head now:\n   - `CURRENT` (exit 0) when nothing moved;\n   - `STALE` (HELD, exit 3) when the candidate moved;\n   - `NONE` (HELD, exit 3) when no verdict is recorded.\n\n   Recording a verdict never makes it stale, because `work/<WP>/` is excluded from the package.\n\n**Not in scope:**\n- S2, S4 and S5;\n- a G08 dossier change (the existing `independent-review` binding is untouched);\n- any gate requiring a verdict before merge;\n- identity (#261): a run id distinguishes sessions, not people.\n\nThe change edits `scripts/badf_gate.py`, an enforcement surface, so under S1 it is **C3**.\n\n## Acceptance criteria\n\n1. `review-package` refuses a non-ancestor, empty or unknown range, and its package digest is reproducible.\n2. `repo` refuses a verdict whose package digest does not recompute, whose authoring and reviewing runs are equal, that has neither findings nor non-coverage, or whose APPROVE contradicts a blocking finding.\n3. A re-review that leaves a prior OPEN finding without a disposition, or dispositions one that was not OPEN, is refused. A cycle of re-reviews, or two unrelated review chains, is refused.\n4. `review-check` reports CURRENT before the candidate moves and STALE after, on a real git repository. Recording the verdict does not move it.\n5. Every control is shown to fail when broken, through mutation testing.\n6. The WP-2026-0157 reconcile is carried; `badf_gate.py repo` passes; and the composed suite is green.\n\n\n---\n_Generated by [Claude Code](https://claude.ai/code)_",
  "authorized_by": {
    "principal": "operator",
    "principal_type": "human"
  },
  "recorded_at": "2026-10-04T00:00:00Z",
  "provenance": "EXPORTED_FROM_SOURCE",
  "status": "AUTHORIZED",
  "note": "ATTRIBUTED, not independently verifiable. In a Claude Code session on 2026-10-04 the operator said 'start WP-2026-0158 and carry the reconcile', after the session had recommended S3 as WP-2026-0158 when WP-2026-0157 landed. Given in this session's channel (AET-I13). No merge-when-green authority was given for this work package. No structural actor field distinguishes the operator from an agent under the shared bstBizEra account (#261 / #308)."
}
